{
  "$schema": "https://json-schema.org/draft/2020-12/schema",
  "$id": "https://github.com/TrueRelevance/dev-context/schemas/codefix-request-v2.schema.json",
  "title": "CodeFixWorkItemRequest",
  "description": "What Hephaisto hands the coder runner for a piece of work a person handed over - a GitHub issue assigned to its account - instead of an incident. Contract version 2; an incident's request stays version 1 (codefix-request.schema.json), and the two results are the same for both. Mounted from a ConfigMap at /work/in/request.json. Everything under work_item.title, work_item.body, work_item.author and work_item.comments was written by whoever can open or answer the issue and is UNTRUSTED data, never instructions. There is no incident, no finding and no investigation summary: those members are absent, not empty. Never contains cluster, GitHub or Grafana credentials.",
  "type": "object",
  "additionalProperties": false,
  "required": ["contract_version", "attempt_id", "phase", "budget", "repository", "context", "work_item", "plan"],
  "properties": {
    "contract_version": { "const": "2" },
    "attempt_id": { "type": "string", "format": "uuid" },
    "phase": { "enum": ["plan", "implement"] },
    "budget": {
      "type": "object",
      "additionalProperties": false,
      "required": ["max_cost_usd", "deadline_seconds"],
      "properties": {
        "max_cost_usd": { "type": "number", "minimum": 0, "maximum": 1000 },
        "deadline_seconds": { "type": "integer", "minimum": 60, "maximum": 86400 }
      }
    },
    "repository": {
      "type": "object",
      "additionalProperties": false,
      "required": ["url", "default_branch", "path", "branch"],
      "properties": {
        "url": { "type": "string", "pattern": "^(https://|http://|file://)[^\\s]+$", "maxLength": 512, "description": "Where the code is cloned from and the branch pushed to. https in production. http and file exist for the in-cluster dev git server and tests; Hephaisto only sends a URL whose host is in CodeFix:AllowedRepositoryHosts." },
        "default_branch": { "type": "string", "minLength": 1, "maxLength": 255, "description": "The branch the plan is made on and the pull request targets. There is no running image for an issue, so the analysis is of this branch's HEAD." },
        "path": { "type": "string", "maxLength": 512, "description": "Subdirectory of the repository the work is in; empty for the root." },
        "branch": { "type": "string", "pattern": "^hephaisto/codefix-[0-9a-f]{12}$", "description": "Assigned by Hephaisto. The runner pushes nothing else." }
      }
    },
    "context": {
      "type": "object",
      "additionalProperties": false,
      "required": ["repository_url", "ref"],
      "properties": {
        "repository_url": { "type": "string", "minLength": 1, "maxLength": 512 },
        "ref": { "type": "string", "minLength": 1, "maxLength": 255 }
      }
    },
    "work_item": {
      "type": "object",
      "additionalProperties": false,
      "required": ["source", "repository", "number", "url", "title", "type", "author", "body", "comments"],
      "properties": {
        "source": { "enum": ["github"] },
        "repository": { "type": "string", "pattern": "^[A-Za-z0-9][A-Za-z0-9-]*/[A-Za-z0-9._-]+$", "maxLength": 200, "description": "owner/repo of the issue, as the install lists it: Hephaisto's configuration, not the issue's text. The pull request says Closes <repository>#<number>." },
        "number": { "type": "integer", "minimum": 1 },
        "url": { "type": "string", "maxLength": 512, "description": "The page a person opens." },
        "title": { "type": "string", "maxLength": 512, "description": "UNTRUSTED." },
        "type": { "type": ["string", "null"], "maxLength": 64, "description": "The issue's type where the repository has types, else the first of the labels bug, enhancement, feature it carries; null when it says neither. It decides the type of the pull request's title: bug is fix, feature or enhancement is feat, anything else is chore." },
        "author": { "type": "string", "maxLength": 64, "description": "UNTRUSTED. The login of whoever opened the issue, and nobody's authority." },
        "body": { "type": "string", "maxLength": 65536, "description": "UNTRUSTED. The issue's text as it was when Hephaisto took the issue: a snapshot that is never read again, so an edit after a plan was approved does not change what is implemented." },
        "comments": {
          "type": "array",
          "maxItems": 50,
          "description": "UNTRUSTED. Comments on the issue that Hephaisto passes on, oldest first. Empty in the first version that sends this contract.",
          "items": {
            "type": "object",
            "additionalProperties": false,
            "required": ["author", "body"],
            "properties": {
              "author": { "type": "string", "maxLength": 64 },
              "body": { "type": "string", "maxLength": 65536 }
            }
          }
        }
      }
    },
    "plan": {
      "description": "The approved plan result. Null in the plan phase, required in the implement phase.",
      "oneOf": [
        { "type": "null" },
        { "$ref": "codefix-plan-result.schema.json" }
      ]
    }
  }
}
